id,title,authors,abstract,year,category,venue,citations
51,An Efficient Approach to Graph Neural Network with Explainable Ai,"Y. Bengio, A. Ng","This work presents a comprehensive study of graph neural network and explainable AI in the context of explainable AI. We evaluate different architectures and identify key bottlenecks associated with graph neural network. Based on these findings, we design an adaptive protocol, NeuroChain, which dynamically tunes parameters to reduce latency. Our evaluation shows robust performance under highly dynamic workloads.",2024,AI/ML,CVPR,200
40,An Efficient Approach to Zero-Shot Learning with Transformer,"J. Smith, D. Silver, I. Sutskever","In this paper, we address the challenge of zero-shot learning and transformer. We propose a new system called FlexScale that leverages zero-shot learning to improve efficiency and performance. Our framework optimizes transformer in a novel way. Experimental results on real-world datasets show that our method outperforms standard baselines, achieving up to 46% improvement in speed and accuracy.",2024,AI/ML,ACL,140
72,Enhancing Vulnerability Protocols Against Zero Trust Attacks,"R. Rivest, D. Song, A. Shamir","We investigate the integration of vulnerability and zero trust to solve vulnerability and zero trust. While promising, this combination introduces security and reliability challenges. We present a formal model and a practical implementation, ApexLink, that addresses these issues through centralized coordination. Our prototypes show that our safety constraints are met with minimal impact on latency.",2019,Cybersecurity,USENIX Security,272
141,Performance Analysis of Lorawan Protocols in Vehicular Network Networks,"M. Ammar, D. Clark","We investigate the integration of loRaWAN and vehicular network to solve loRaWAN and vehicular network. While promising, this combination introduces security and reliability challenges. We present a formal model and a practical implementation, FlexSense, that addresses these issues through centralized coordination. Our prototypes show that our safety constraints are met with minimal impact on latency.",2024,Networks & IoT,ACM CoNEXT,41
58,Detecting Side-Channel Anomalies in Cryptography,"B. Parno, L. Adleman, V. Shmatikov","We investigate the integration of side-channel and cryptography to solve side-channel and cryptography. While promising, this combination introduces security and reliability challenges. We present a formal model and a practical implementation, ParaChain, that addresses these issues through centralized coordination. Our prototypes show that our safety constraints are met with minimal impact on latency.",2026,Cybersecurity,S&P (Oakland),284
57,Exploring the Limits of Zero-Shot Learning in Fine-Tuning,"I. Sutskever, F. Li","In this paper, we address the challenge of zero-shot learning and fine-tuning. We propose a new system called DeepFlow that leverages zero-shot learning to improve efficiency and performance. Our framework optimizes fine-tuning in a novel way. Experimental results on real-world datasets show that our method outperforms standard baselines, achieving up to 22% improvement in speed and accuracy.",2022,AI/ML,CVPR,102
73,The Role of Adversarial Attacks in Decentralized Intrusion Detection,"M. Naor, D. Song, A. Shamir","How can we scale adversarial attacks and intrusion detection to meet the demands of modern workloads? We argue that standard methods focusing on adversarial attacks are insufficient due to physical constraints. We propose HyperTrust, which distributes computation using intrusion detection. Through mathematical proof and extensive simulation, we show that our architecture guarantees fault-tolerance and scales linearly.",2020,Cybersecurity,IEEE TIFS,307
91,Efficient Indexing of Vector Database in Distributed Partitioning,"J. Dean, D. DeWitt, S. Ghemawat","How can we scale vector database and partitioning to meet the demands of modern workloads? We argue that standard methods focusing on vector database are insufficient due to physical constraints. We propose NeuroDB, which distributes computation using partitioning. Through mathematical proof and extensive simulation, we show that our architecture guarantees fault-tolerance and scales linearly.",2022,Data Engineering,EDBT,22
147,Performance Analysis of Smart Home Protocols in Vehicular Network Networks,"D. Clark, D. Estrin","This work presents a comprehensive study of smart home and vehicular network in the context of vehicular network. We evaluate different architectures and identify key bottlenecks associated with smart home. Based on these findings, we design an adaptive protocol, HyperDB, which dynamically tunes parameters to reduce latency. Our evaluation shows robust performance under highly dynamic workloads.",2020,Networks & IoT,MobiCom,231
109,An Assistive Voice Assistant Tool for Eye Tracking Accessibility,"S. Klemmer, E. Horvitz","In this paper, we address the challenge of voice assistant and eye tracking. We propose a new system called ParaTrust that leverages voice assistant to improve efficiency and performance. Our framework optimizes eye tracking in a novel way. Experimental results on real-world datasets show that our method outperforms standard baselines, achieving up to 55% improvement in speed and accuracy.",2018,HCI,CSCW,158
118,An Assistive Augmented Reality Tool for Accessibility Accessibility,"A. Dey, J. Landay","Recent advancements in augmented reality have enabled significant breakthroughs in augmented reality and accessibility. However, existing solutions suffer from high overhead and poor scalability when applied to accessibility. To overcome these limitations, we introduce DeepGate, a lightweight approach. We demonstrate its effectiveness across multiple domains, illustrating its suitability for production environments.",2022,HCI,CSCW,98
94,Evaluating Consensus in Distributed Database for Indexing Pipelines,"S. Ghemawat, M. Stonebraker","How can we scale distributed database and indexing to meet the demands of modern workloads? We argue that standard methods focusing on distributed database are insufficient due to physical constraints. We propose SmartDB, which distributes computation using indexing. Through mathematical proof and extensive simulation, we show that our architecture guarantees fault-tolerance and scales linearly.",2022,Data Engineering,SIGMOD,349
88,Scaling Stream Processing for Large-scale Graph Database,"D. DeWitt, A. Halevy, J. Hellerstein","This work presents a comprehensive study of stream processing and graph database in the context of graph database. We evaluate different architectures and identify key bottlenecks associated with stream processing. Based on these findings, we design an adaptive protocol, SmartGlove, which dynamically tunes parameters to reduce latency. Our evaluation shows robust performance under highly dynamic workloads.",2020,Data Engineering,SIGMOD,188
93,Scaling Mapreduce for Large-scale Stream Processing,"M. Zaharia, A. Halevy","We investigate the integration of MapReduce and stream processing to solve MapReduce and stream processing. While promising, this combination introduces security and reliability challenges. We present a formal model and a practical implementation, HyperLink, that addresses these issues through centralized coordination. Our prototypes show that our safety constraints are met with minimal impact on latency.",2023,Data Engineering,ICDE,328
15,Meltdown and Spectre: Exploiting Out-of-Order Execution in Modern CPUs,"V. Shmatikov, A. Shamir","We describe Meltdown and Spectre, hardware vulnerabilities that exploit out-of-order execution and speculative execution in modern processors. These side-channel attacks allow unprivileged processes to read sensitive kernel memory and data from other processes.",2020,Cybersecurity,NDSS,25
132,Software-defined Network Slicing Solutions for Sdn,"D. Clark, I. Akyildiz, J. Rexford","In this paper, we address the challenge of network slicing and SDN. We propose a new system called SmartDB that leverages network slicing to improve efficiency and performance. Our framework optimizes SDN in a novel way. Experimental results on real-world datasets show that our method outperforms standard baselines, achieving up to 33% improvement in speed and accuracy.",2019,Networks & IoT,ACM CoNEXT,338
25,Graph Databases for Querying Highly Connected Social Networks,"M. Stonebraker, J. Dean","Relational databases struggle with deep join operations in highly connected social graphs. We evaluate graph database models, presenting an optimized index-free adjacency traversal method that speeds up recursive path queries and community detection algorithms.",2023,Data Engineering,EDBT,219
106,Co-designing Augmented Reality with Users for Collaborative Tools Applications,"B. Shneiderman, E. Horvitz, J. Landay","We investigate the integration of augmented reality and collaborative tools to solve augmented reality and collaborative tools. While promising, this combination introduces security and reliability challenges. We present a formal model and a practical implementation, HyperChain, that addresses these issues through centralized coordination. Our prototypes show that our safety constraints are met with minimal impact on latency.",2021,HCI,TOCHI,258
115,The Impact of Voice Assistant on User Experience in Wearables,"E. Horvitz, D. Norman","How can we scale voice assistant and wearables to meet the demands of modern workloads? We argue that standard methods focusing on voice assistant are insufficient due to physical constraints. We propose ApexFlow, which distributes computation using wearables. Through mathematical proof and extensive simulation, we show that our architecture guarantees fault-tolerance and scales linearly.",2026,HCI,CHI,149
97,A Highly Available Nosql System for Mapreduce,"S. Ghemawat, M. Stonebraker, J. Gray","We investigate the integration of NoSQL and MapReduce to solve NoSQL and MapReduce. While promising, this combination introduces security and reliability challenges. We present a formal model and a practical implementation, ApexNet, that addresses these issues through centralized coordination. Our prototypes show that our safety constraints are met with minimal impact on latency.",2019,Data Engineering,ICDE,155
50,Optimizing Diffusion Models Using Contrastive Learning Techniques,"A. Ng, A. Vaswani, I. Sutskever","We investigate the integration of diffusion models and contrastive learning to solve diffusion models and contrastive learning. While promising, this combination introduces security and reliability challenges. We present a formal model and a practical implementation, ApexScale, that addresses these issues through centralized coordination. Our prototypes show that our safety constraints are met with minimal impact on latency.",2018,AI/ML,NeurIPS,35
108,An Assistive Wearables Tool for Augmented Reality Accessibility,"J. Landay, P. Baudisch, A. Dey","This work presents a comprehensive study of wearables and augmented reality in the context of augmented reality. We evaluate different architectures and identify key bottlenecks associated with wearables. Based on these findings, we design an adaptive protocol, MetaChain, which dynamically tunes parameters to reduce latency. Our evaluation shows robust performance under highly dynamic workloads.",2025,HCI,CSCW,214
12,Zero-Knowledge Proofs for Privacy-Preserving Blockchain Transactions,"M. Naor, L. Adleman","We introduce a novel protocol for privacy-preserving transactions in decentralized blockchain databases using zero-knowledge succinct non-interactive arguments of knowledge (zk-SNARKs). Our system hides the transaction sender, recipient, and amounts while guaranteeing consistency.",2020,Cybersecurity,NDSS,360
122,Designing Collaborative Tools Interfaces for Accessibility,"P. Baudisch, D. Norman, B. Shneiderman","Recent advancements in collaborative tools have enabled significant breakthroughs in collaborative tools and accessibility. However, existing solutions suffer from high overhead and poor scalability when applied to accessibility. To overcome these limitations, we introduce VeloGate, a lightweight approach. We demonstrate its effectiveness across multiple domains, illustrating its suitability for production environments.",2025,HCI,UIST,191
131,Software-defined Routing Protocol Solutions for Sdn,"S. Shenker, T. Anderson, D. Estrin","How can we scale routing protocol and SDN to meet the demands of modern workloads? We argue that standard methods focusing on routing protocol are insufficient due to physical constraints. We propose SecureTrust, which distributes computation using SDN. Through mathematical proof and extensive simulation, we show that our architecture guarantees fault-tolerance and scales linearly.",2026,Networks & IoT,SIGCOMM,56
39,Evaluating Neural Network Architectures on Explainable Ai Tasks,"G. Hinton, A. Ng","Recent advancements in neural network have enabled significant breakthroughs in neural network and explainable AI. However, existing solutions suffer from high overhead and poor scalability when applied to explainable AI. To overcome these limitations, we introduce NeuroScale, a lightweight approach. We demonstrate its effectiveness across multiple domains, illustrating its suitability for production environments.",2021,AI/ML,NeurIPS,25
10,Federated Learning for Privacy-Preserving Collaborative Machine Learning,"J. Smith, K. He","Modern mobile devices have access to a wealth of data suitable for training machine learning models. We introduce a federated learning framework where mobile clients collaboratively train a shared global model while keeping all the training data local, mitigating privacy risks.",2021,AI/ML,KDD,372
117,Designing Collaborative Tools Interfaces for Haptics,"J. Landay, D. Norman","In this paper, we address the challenge of collaborative tools and haptics. We propose a new system called MetaGate that leverages collaborative tools to improve efficiency and performance. Our framework optimizes haptics in a novel way. Experimental results on real-world datasets show that our method outperforms standard baselines, achieving up to 51% improvement in speed and accuracy.",2023,HCI,DIS,285
28,Designing Explanations for User Trust in Interactive AI Systems,"J. Landay, S. Klemmer","Explainable AI systems often focus on technical descriptions that confuse non-expert users. We design and evaluate three explanation modalities (textual, visual, and example-based) to understand how different interface designs impact user trust and reliance on AI recommendations.",2025,HCI,CHI,372
133,Securing Edge Computing Communications in Smart 5G,"I. Akyildiz, T. Anderson","This work presents a comprehensive study of edge computing and 5G in the context of 5G. We evaluate different architectures and identify key bottlenecks associated with edge computing. Based on these findings, we design an adaptive protocol, ParaDB, which dynamically tunes parameters to reduce latency. Our evaluation shows robust performance under highly dynamic workloads.",2024,Networks & IoT,SIGCOMM,125
21,In Search of an Understandable Consensus Algorithm (Raft),"M. Stonebraker, D. DeWitt","Raft is a consensus algorithm for managing a replicated log. It produces a result equivalent to Paxos and is equally efficient, but its structure is different from Paxos; this makes Raft more understandable than Paxos and provides a better foundation for building practical systems.",2018,Data Engineering,EDBT,328
103,An Assistive Augmented Reality Tool for Wearables Accessibility,"S. Klemmer, H. Ishii","This work presents a comprehensive study of augmented reality and wearables in the context of wearables. We evaluate different architectures and identify key bottlenecks associated with augmented reality. Based on these findings, we design an adaptive protocol, NeuroGlove, which dynamically tunes parameters to reduce latency. Our evaluation shows robust performance under highly dynamic workloads.",2018,HCI,DIS,280
33,Software-Defined Networking (SDN) for Dynamic Traffic Engineering,"S. Shenker, H. Balakrishnan","Traditional IP routing struggles to adapt to rapid network traffic fluctuations. We present a Software-Defined Networking framework that uses centralized controller policies to dynamically re-route traffic, optimizing link utilization and preventing packet loss.",2021,Networks & IoT,IEEE IoT-J,224
70,The Role of Malware in Decentralized Ransomware,"E. Shi, V. Shmatikov, M. Naor","This work presents a comprehensive study of malware and ransomware in the context of ransomware. We evaluate different architectures and identify key bottlenecks associated with malware. Based on these findings, we design an adaptive protocol, FlexNet, which dynamically tunes parameters to reduce latency. Our evaluation shows robust performance under highly dynamic workloads.",2018,Cybersecurity,S&P (Oakland),31
29,Haptic Feedback Interfaces for Virtual Reality Text Entry,"A. Dey, J. Landay","Text entry in virtual reality is historically slow and error-prone due to the lack of tactile feedback. We propose a wearable haptic ring that provides precise vibrotactile impulses to simulate physical keypresses, resulting in a 25% increase in typing speed.",2018,HCI,CSCW,447
62,The Role of Ransomware in Decentralized Federated Privacy,"M. Naor, R. Rivest, V. Shmatikov","We investigate the integration of ransomware and federated privacy to solve ransomware and federated privacy. While promising, this combination introduces security and reliability challenges. We present a formal model and a practical implementation, SecureFlow, that addresses these issues through centralized coordination. Our prototypes show that our safety constraints are met with minimal impact on latency.",2019,Cybersecurity,S&P (Oakland),213
119,Designing Wearables Interfaces for Haptics,"E. Horvitz, H. Ishii, B. Shneiderman","How can we scale wearables and haptics to meet the demands of modern workloads? We argue that standard methods focusing on wearables are insufficient due to physical constraints. We propose HyperLink, which distributes computation using haptics. Through mathematical proof and extensive simulation, we show that our architecture guarantees fault-tolerance and scales linearly.",2019,HCI,CHI,46
105,Empirical Study of User Experience in Virtual Collaborative Tools,"S. Klemmer, D. Norman, P. Baudisch","We investigate the integration of user experience and collaborative tools to solve user experience and collaborative tools. While promising, this combination introduces security and reliability challenges. We present a formal model and a practical implementation, SecureFlow, that addresses these issues through centralized coordination. Our prototypes show that our safety constraints are met with minimal impact on latency.",2019,HCI,CSCW,296
100,Optimizing Queries in Partitioning Databases for Olap,"H. Garcia-Molina, J. Gray","How can we scale partitioning and OLAP to meet the demands of modern workloads? We argue that standard methods focusing on partitioning are insufficient due to physical constraints. We propose FlexNet, which distributes computation using OLAP. Through mathematical proof and extensive simulation, we show that our architecture guarantees fault-tolerance and scales linearly.",2022,Data Engineering,VLDB,243
110,Co-designing Accessibility with Users for Eye Tracking Applications,"H. Ishii, D. Norman, P. Baudisch","We investigate the integration of accessibility and eye tracking to solve accessibility and eye tracking. While promising, this combination introduces security and reliability challenges. We present a formal model and a practical implementation, MetaNet, that addresses these issues through centralized coordination. Our prototypes show that our safety constraints are met with minimal impact on latency.",2019,HCI,TOCHI,305
68,Enhancing Blockchain Protocols Against Side-Channel Attacks,"B. Parno, V. Shmatikov, D. Song","In this paper, we address the challenge of blockchain and side-channel. We propose a new system called HyperGlove that leverages blockchain to improve efficiency and performance. Our framework optimizes side-channel in a novel way. Experimental results on real-world datasets show that our method outperforms standard baselines, achieving up to 18% improvement in speed and accuracy.",2026,Cybersecurity,IEEE TIFS,336
144,Performance Analysis of Lorawan Protocols in Routing Protocol Networks,"J. Rexford, D. Estrin","In this paper, we address the challenge of loRaWAN and routing protocol. We propose a new system called MetaGlove that leverages loRaWAN to improve efficiency and performance. Our framework optimizes routing protocol in a novel way. Experimental results on real-world datasets show that our method outperforms standard baselines, achieving up to 42% improvement in speed and accuracy.",2026,Networks & IoT,ACM CoNEXT,8
22,Vector Databases for Efficient Semantic Search at Scale,"J. Gray, M. Zaharia","The explosion of deep learning representations has made semantic vector search a core database requirement. We describe the design of a vector database optimized for indexing high-dimensional embeddings, comparing Hierarchical Navigable Small World (HNSW) graphs with inverted file index (IVF) structures.",2025,Data Engineering,SIGMOD,64
134,Software-defined Sdn Solutions for Coap,"D. Clark, D. Estrin, I. Akyildiz","Recent advancements in SDN have enabled significant breakthroughs in SDN and coap. However, existing solutions suffer from high overhead and poor scalability when applied to coap. To overcome these limitations, we introduce FlexGate, a lightweight approach. We demonstrate its effectiveness across multiple domains, illustrating its suitability for production environments.",2018,Networks & IoT,ACM CoNEXT,246
3,Generative Adversarial Nets for Unsupervised Representation Learning,"F. Li, G. Hinton","We propose a new framework for estimating generative models via an adversarial process, in which we simultaneously train two models: a generative model that captures the data distribution, and a discriminative model that estimates the probability that a sample came from the training data rather than the generator.",2023,AI/ML,CVPR,372
64,A Cryptography Framework for Secure Smart Contracts,"S. Goldwasser, B. Parno","We investigate the integration of cryptography and smart contracts to solve cryptography and smart contracts. While promising, this combination introduces security and reliability challenges. We present a formal model and a practical implementation, ParaLink, that addresses these issues through centralized coordination. Our prototypes show that our safety constraints are met with minimal impact on latency.",2026,Cybersecurity,USENIX Security,58
135,Optimizing Vehicular Network Routing in IoT-based Smart Home,"D. Estrin, V. Bahl, S. Shenker","This work presents a comprehensive study of vehicular network and smart home in the context of smart home. We evaluate different architectures and identify key bottlenecks associated with vehicular network. Based on these findings, we design an adaptive protocol, MetaChain, which dynamically tunes parameters to reduce latency. Our evaluation shows robust performance under highly dynamic workloads.",2025,Networks & IoT,ACM CoNEXT,107
42,Beyond Deep Learning: Self-supervised Zero-Shot Learning Paradigms,"Y. LeCun, Y. Bengio","This work presents a comprehensive study of deep learning and zero-shot learning in the context of zero-shot learning. We evaluate different architectures and identify key bottlenecks associated with deep learning. Based on these findings, we design an adaptive protocol, SecureScale, which dynamically tunes parameters to reduce latency. Our evaluation shows robust performance under highly dynamic workloads.",2025,AI/ML,KDD,261
47,Exploring the Limits of Large Language Model in Transformer,"Y. Bengio, A. Ng","How can we scale large language model and transformer to meet the demands of modern workloads? We argue that standard methods focusing on large language model are insufficient due to physical constraints. We propose FlexGate, which distributes computation using transformer. Through mathematical proof and extensive simulation, we show that our architecture guarantees fault-tolerance and scales linearly.",2021,AI/ML,KDD,11
101,Scaling Stream Processing for Large-scale Distributed Database,"M. Stonebraker, D. DeWitt","This work presents a comprehensive study of stream processing and distributed database in the context of distributed database. We evaluate different architectures and identify key bottlenecks associated with stream processing. Based on these findings, we design an adaptive protocol, SecureGate, which dynamically tunes parameters to reduce latency. Our evaluation shows robust performance under highly dynamic workloads.",2018,Data Engineering,TODS,147
34,Dynamic Network Slicing in 5G Cellular Infrastructures,"T. Anderson, M. Ammar","5G networks must support diverse applications from autonomous driving to massive IoT sensors. We propose a dynamic network slicing algorithm that partitions physical radio resources into isolated virtual slices, satisfying distinct quality-of-service (QoS) guarantees.",2025,Networks & IoT,MobiCom,17
17,Deep Learning for Network Intrusion Detection in IoT Systems,"V. Shmatikov, L. Adleman","Internet of Things (IoT) devices are vulnerable to distributed denial-of-service (DDoS) attacks. We evaluate a deep learning framework based on Bidirectional LSTM networks for real-time network intrusion detection, achieving high accuracy in classifying malicious traffic.",2022,Cybersecurity,CCS,26
