id,title,authors,abstract,year,category,venue,citations
77,Analyzing the Security of Side-Channel in Federated Privacy Applications,"S. Goldwasser, L. Adleman","How can we scale side-channel and federated privacy to meet the demands of modern workloads? We argue that standard methods focusing on side-channel are insufficient due to physical constraints. We propose NeuroDB, which distributes computation using federated privacy. Through mathematical proof and extensive simulation, we show that our architecture guarantees fault-tolerance and scales linearly.",2020,Cybersecurity,S&P (Oakland),61
9,Reinforcement Learning with Double Q-learning in Complex Environments,"A. Vaswani, I. Sutskever","The popular Q-learning algorithm is known to overestimate action values under certain conditions. In this paper, we show that double Q-learning can prevent these overestimations, leading to better policies and state-of-the-art performance on Atari games and robotic control systems.",2024,AI/ML,ACL,13
20,Resilient Distributed Datasets: A Fault-Tolerant Abstraction for In-Memory Computing,"J. Gray, M. Zaharia","We present Resilient Distributed Datasets (RDDs), a distributed memory abstraction that lets programmers perform in-memory computations on large clusters in a fault-tolerant manner. RDDs enable iterative algorithms in data mining and machine learning to run up to 100x faster than MapReduce.",2023,Data Engineering,ICDE,194
148,Securing 5G Communications in Smart Mqtt,"H. Balakrishnan, D. Estrin, V. Bahl","Recent advancements in 5G have enabled significant breakthroughs in 5G and mqtt. However, existing solutions suffer from high overhead and poor scalability when applied to mqtt. To overcome these limitations, we introduce SmartLink, a lightweight approach. We demonstrate its effectiveness across multiple domains, illustrating its suitability for production environments.",2020,Networks & IoT,MobiCom,57
84,Olap Architectures: A Survey of Indexing Systems,"J. Gray, M. Stonebraker, J. Dean","This work presents a comprehensive study of OLAP and indexing in the context of indexing. We evaluate different architectures and identify key bottlenecks associated with OLAP. Based on these findings, we design an adaptive protocol, FlexScale, which dynamically tunes parameters to reduce latency. Our evaluation shows robust performance under highly dynamic workloads.",2022,Data Engineering,SIGMOD,252
61,Detecting Adversarial Attacks Anomalies in Zero Trust,"V. Shmatikov, M. Naor, S. Goldwasser","We investigate the integration of adversarial attacks and zero trust to solve adversarial attacks and zero trust. While promising, this combination introduces security and reliability challenges. We present a formal model and a practical implementation, HyperGlove, that addresses these issues through centralized coordination. Our prototypes show that our safety constraints are met with minimal impact on latency.",2021,Cybersecurity,S&P (Oakland),103
7,Retrieval-Augmented Generation for Knowledge-Intensive NLP Tasks,"I. Sutskever, J. Smith","Large pre-trained language models have been shown to store implicit knowledge, but their ability to access and precisely manipulate knowledge is still limited. We propose a hybrid framework combining a pre-trained retriever with a generator (RAG) to improve accuracy in open-domain question answering.",2023,AI/ML,ACL,63
146,Performance Analysis of 6G Protocols in Lorawan Networks,"J. Rexford, S. Shenker, H. Balakrishnan","This work presents a comprehensive study of 6G and loRaWAN in the context of loRaWAN. We evaluate different architectures and identify key bottlenecks associated with 6G. Based on these findings, we design an adaptive protocol, ApexDB, which dynamically tunes parameters to reduce latency. Our evaluation shows robust performance under highly dynamic workloads.",2026,Networks & IoT,MobiCom,177
54,Exploring the Limits of Large Language Model in Transformer,"D. Silver, J. Smith","We investigate the integration of large language model and transformer to solve large language model and transformer. While promising, this combination introduces security and reliability challenges. We present a formal model and a practical implementation, MetaGate, that addresses these issues through centralized coordination. Our prototypes show that our safety constraints are met with minimal impact on latency.",2026,AI/ML,ACL,198
123,The Impact of Haptics on User Experience in User Experience,"J. Landay, P. Baudisch, M. Bernstein","Recent advancements in haptics have enabled significant breakthroughs in haptics and user experience. However, existing solutions suffer from high overhead and poor scalability when applied to user experience. To overcome these limitations, we introduce ParaGate, a lightweight approach. We demonstrate its effectiveness across multiple domains, illustrating its suitability for production environments.",2020,HCI,TOCHI,274
66,Analyzing the Security of Federated Privacy in Intrusion Detection Applications,"R. Rivest, L. Adleman","How can we scale federated privacy and intrusion detection to meet the demands of modern workloads? We argue that standard methods focusing on federated privacy are insufficient due to physical constraints. We propose HyperChain, which distributes computation using intrusion detection. Through mathematical proof and extensive simulation, we show that our architecture guarantees fault-tolerance and scales linearly.",2021,Cybersecurity,S&P (Oakland),170
90,Raft Consensus Architectures: A Survey of Graph Database Systems,"M. Zaharia, S. Ghemawat","Recent advancements in Raft consensus have enabled significant breakthroughs in Raft consensus and graph database. However, existing solutions suffer from high overhead and poor scalability when applied to graph database. To overcome these limitations, we introduce VeloNet, a lightweight approach. We demonstrate its effectiveness across multiple domains, illustrating its suitability for production environments.",2021,Data Engineering,SIGMOD,166
81,Scaling Indexing for Large-scale Data Lake,"D. DeWitt, A. Halevy","We investigate the integration of indexing and data lake to solve indexing and data lake. While promising, this combination introduces security and reliability challenges. We present a formal model and a practical implementation, ApexNet, that addresses these issues through centralized coordination. Our prototypes show that our safety constraints are met with minimal impact on latency.",2022,Data Engineering,TODS,204
5,Graph Convolutional Networks for Semi-Supervised Classification,"Y. Bengio, I. Sutskever",We present a scalable approach for semi-supervised learning on graph-structured data that is based on an efficient variant of convolutional neural networks which operate directly on graphs. We motivate the choice of our convolutional architecture via a localized first-order approximation of spectral graph convolutions.,2024,AI/ML,CVPR,245
69,Mitigating Adversarial Attacks Vulnerabilities in Side-Channel Environments,"L. Adleman, R. Rivest","How can we scale adversarial attacks and side-channel to meet the demands of modern workloads? We argue that standard methods focusing on adversarial attacks are insufficient due to physical constraints. We propose ParaScale, which distributes computation using side-channel. Through mathematical proof and extensive simulation, we show that our architecture guarantees fault-tolerance and scales linearly.",2025,Cybersecurity,IEEE TIFS,254
98,Evaluating Consensus in Partitioning for Nosql Pipelines,"M. Zaharia, J. Hellerstein, J. Gray","How can we scale partitioning and NoSQL to meet the demands of modern workloads? We argue that standard methods focusing on partitioning are insufficient due to physical constraints. We propose SmartSense, which distributes computation using NoSQL. Through mathematical proof and extensive simulation, we show that our architecture guarantees fault-tolerance and scales linearly.",2021,Data Engineering,TODS,271
129,Securing Coap Communications in Smart Mqtt,"D. Estrin, J. Rexford","In this paper, we address the challenge of coap and mqtt. We propose a new system called ApexSense that leverages coap to improve efficiency and performance. Our framework optimizes mqtt in a novel way. Experimental results on real-world datasets show that our method outperforms standard baselines, achieving up to 23% improvement in speed and accuracy.",2022,Networks & IoT,MobiCom,74
32,Edge Computing Architectures for Low-Latency IoT Applications,"D. Estrin, V. Bahl","Cloud computing introduces substantial latency for real-time IoT control loops. We present a multi-tier edge computing architecture that shifts computation and storage closer to the sensors, evaluating latency reductions and bandwidth savings in smart city video analytics.",2022,Networks & IoT,ACM CoNEXT,73
46,Optimizing Deep Learning Using Contrastive Learning Techniques,"A. Vaswani, A. Ng","We investigate the integration of deep learning and contrastive learning to solve deep learning and contrastive learning. While promising, this combination introduces security and reliability challenges. We present a formal model and a practical implementation, NeuroGate, that addresses these issues through centralized coordination. Our prototypes show that our safety constraints are met with minimal impact on latency.",2026,AI/ML,ACL,2
23,Spanner: Google's Globally-Distributed Database,"J. Gray, H. Garcia-Molina",Spanner is Google's globally-distributed database. It is the first system to distribute data globally and support externally-consistent distributed transactions. Spanner uses hardware GPS receivers and atomic clocks to ensure tight synchronization across datacenters.,2026,Data Engineering,ICDE,174
27,Eye Tracking for Hands-Free Desktop Navigation,"P. Baudisch, A. Dey","We present a hands-free desktop navigation system using eye tracking and blink-duration heuristics. We evaluate how visual feedback and dynamic dwell times can mitigate the 'Midas Touch' problem, where accidental fixations trigger unwanted click actions.",2022,HCI,DIS,339
35,Secure and Scalable Routing Protocols for Vehicular Ad-hoc Networks (VANET),"J. Rexford, D. Clark",High mobility and intermittent links make routing in vehicular networks challenging. We present a geographic routing protocol for VANETs that uses road traffic density predictions and cryptographic message signatures to ensure packet delivery and prevent spoofing attacks.,2020,Networks & IoT,SIGCOMM,384
2,Deep Residual Learning for Image Recognition,"A. Ng, Y. LeCun","Deeper neural networks are more difficult to train. We present a residual learning framework to ease the training of networks that are substantially deeper than those previously used. We explicitly reformulate the layers as learning residual functions with reference to the layer inputs, instead of learning unreferenced functions.",2026,AI/ML,CVPR,125
114,Evaluating Haptic User Experience for Accessibility Control,"P. Baudisch, S. Klemmer","Recent advancements in user experience have enabled significant breakthroughs in user experience and accessibility. However, existing solutions suffer from high overhead and poor scalability when applied to accessibility. To overcome these limitations, we introduce SmartSense, a lightweight approach. We demonstrate its effectiveness across multiple domains, illustrating its suitability for production environments.",2019,HCI,DIS,287
60,Detecting Ransomware Anomalies in Zero Trust,"E. Shi, M. Naor, S. Goldwasser","This work presents a comprehensive study of ransomware and zero trust in the context of zero trust. We evaluate different architectures and identify key bottlenecks associated with ransomware. Based on these findings, we design an adaptive protocol, MetaScale, which dynamically tunes parameters to reduce latency. Our evaluation shows robust performance under highly dynamic workloads.",2022,Cybersecurity,CCS,267
83,Raft Consensus Architectures: A Survey of Mapreduce Systems,"J. Hellerstein, A. Halevy, M. Stonebraker","How can we scale Raft consensus and MapReduce to meet the demands of modern workloads? We argue that standard methods focusing on Raft consensus are insufficient due to physical constraints. We propose VeloNet, which distributes computation using MapReduce. Through mathematical proof and extensive simulation, we show that our architecture guarantees fault-tolerance and scales linearly.",2019,Data Engineering,VLDB,244
142,Performance Analysis of 6G Protocols in Sensor Networks Networks,"T. Anderson, H. Balakrishnan","We investigate the integration of 6G and sensor networks to solve 6G and sensor networks. While promising, this combination introduces security and reliability challenges. We present a formal model and a practical implementation, SecureChain, that addresses these issues through centralized coordination. Our prototypes show that our safety constraints are met with minimal impact on latency.",2019,Networks & IoT,ACM CoNEXT,272
89,Efficient Indexing of Data Lake in Distributed Partitioning,"J. Dean, M. Zaharia","In this paper, we address the challenge of data lake and partitioning. We propose a new system called DeepFlow that leverages data lake to improve efficiency and performance. Our framework optimizes partitioning in a novel way. Experimental results on real-world datasets show that our method outperforms standard baselines, achieving up to 31% improvement in speed and accuracy.",2018,Data Engineering,ICDE,210
143,An Adaptive Edge Computing Slicing Model for Cellular 6G,"D. Estrin, H. Balakrishnan","In this paper, we address the challenge of edge computing and 6G. We propose a new system called SmartNet that leverages edge computing to improve efficiency and performance. Our framework optimizes 6G in a novel way. Experimental results on real-world datasets show that our method outperforms standard baselines, achieving up to 50% improvement in speed and accuracy.",2022,Networks & IoT,IEEE IoT-J,278
121,Designing Augmented Reality Interfaces for Accessibility,"M. Bernstein, B. Shneiderman","We investigate the integration of augmented reality and accessibility to solve augmented reality and accessibility. While promising, this combination introduces security and reliability challenges. We present a formal model and a practical implementation, SmartGlove, that addresses these issues through centralized coordination. Our prototypes show that our safety constraints are met with minimal impact on latency.",2020,HCI,DIS,311
79,Mitigating Ransomware Vulnerabilities in Adversarial Attacks Environments,"B. Parno, M. Naor","This work presents a comprehensive study of ransomware and adversarial attacks in the context of adversarial attacks. We evaluate different architectures and identify key bottlenecks associated with ransomware. Based on these findings, we design an adaptive protocol, MetaGlove, which dynamically tunes parameters to reduce latency. Our evaluation shows robust performance under highly dynamic workloads.",2024,Cybersecurity,S&P (Oakland),273
45,An Efficient Approach to Explainable Ai with Deep Learning,"Y. Bengio, D. Silver","How can we scale explainable AI and deep learning to meet the demands of modern workloads? We argue that standard methods focusing on explainable AI are insufficient due to physical constraints. We propose FlexChain, which distributes computation using deep learning. Through mathematical proof and extensive simulation, we show that our architecture guarantees fault-tolerance and scales linearly.",2026,AI/ML,CVPR,322
71,Mitigating Federated Privacy Vulnerabilities in Blockchain Environments,"S. Goldwasser, B. Parno, V. Shmatikov","We investigate the integration of federated privacy and blockchain to solve federated privacy and blockchain. While promising, this combination introduces security and reliability challenges. We present a formal model and a practical implementation, HyperGlove, that addresses these issues through centralized coordination. Our prototypes show that our safety constraints are met with minimal impact on latency.",2020,Cybersecurity,USENIX Security,162
87,Evaluating Consensus in Mapreduce for Olap Pipelines,"H. Garcia-Molina, S. Ghemawat, M. Zaharia","In this paper, we address the challenge of MapReduce and OLAP. We propose a new system called MetaDB that leverages MapReduce to improve efficiency and performance. Our framework optimizes OLAP in a novel way. Experimental results on real-world datasets show that our method outperforms standard baselines, achieving up to 46% improvement in speed and accuracy.",2026,Data Engineering,ICDE,303
14,A Zero Trust Architecture for Secure Enterprise Networks,"L. Adleman, B. Parno","Traditional perimeter-based network security models are inadequate for modern enterprise environments. We present a Zero Trust architecture that eliminates implicit trust, requiring continuous authentication, authorization, and validation of all users and devices before granting access.",2022,Cybersecurity,USENIX Security,341
55,Exploring the Limits of Diffusion Models in Transformer,"F. Li, I. Sutskever, D. Silver","Recent advancements in diffusion models have enabled significant breakthroughs in diffusion models and transformer. However, existing solutions suffer from high overhead and poor scalability when applied to transformer. To overcome these limitations, we introduce FlexNet, a lightweight approach. We demonstrate its effectiveness across multiple domains, illustrating its suitability for production environments.",2021,AI/ML,CVPR,254
138,A Resource-efficient 5G Architecture for Edge Edge Computing,"H. Balakrishnan, I. Akyildiz","In this paper, we address the challenge of 5G and edge computing. We propose a new system called SecureGlove that leverages 5G to improve efficiency and performance. Our framework optimizes edge computing in a novel way. Experimental results on real-world datasets show that our method outperforms standard baselines, achieving up to 39% improvement in speed and accuracy.",2021,Networks & IoT,MobiCom,34
26,Augmented Reality Interfaces for Assistive Remote Collaboration,"S. Klemmer, P. Baudisch","Remote collaboration requires shared visual spatial context. We introduce a spatial augmented reality interface that projects hand gestures, drawing annotations, and 3D pointer icons onto a local workspace, significantly reducing cognitive load and task completion times.",2022,HCI,UIST,424
75,Mitigating Blockchain Vulnerabilities in Cryptography Environments,"B. Parno, L. Adleman","How can we scale blockchain and cryptography to meet the demands of modern workloads? We argue that standard methods focusing on blockchain are insufficient due to physical constraints. We propose SecureNet, which distributes computation using cryptography. Through mathematical proof and extensive simulation, we show that our architecture guarantees fault-tolerance and scales linearly.",2023,Cybersecurity,CCS,151
8,Denoising Diffusion Probabilistic Models for High-Fidelity Synthesis,"Y. LeCun, I. Sutskever","We present high quality image synthesis results using diffusion probabilistic models, a class of latent variable models inspired by considerations from non-equilibrium thermodynamics. Our models generate highly realistic images by learning to reverse a gradual denoising process.",2022,AI/ML,NeurIPS,426
120,Evaluating Haptic Virtual Reality for Eye Tracking Control,"S. Klemmer, B. Shneiderman, P. Baudisch","We investigate the integration of virtual reality and eye tracking to solve virtual reality and eye tracking. While promising, this combination introduces security and reliability challenges. We present a formal model and a practical implementation, ApexScale, that addresses these issues through centralized coordination. Our prototypes show that our safety constraints are met with minimal impact on latency.",2026,HCI,CSCW,275
63,Analyzing the Security of Federated Privacy in Malware Applications,"D. Song, L. Adleman","Recent advancements in federated privacy have enabled significant breakthroughs in federated privacy and malware. However, existing solutions suffer from high overhead and poor scalability when applied to malware. To overcome these limitations, we introduce DeepGlove, a lightweight approach. We demonstrate its effectiveness across multiple domains, illustrating its suitability for production environments.",2021,Cybersecurity,CCS,268
116,An Assistive Virtual Reality Tool for Collaborative Tools Accessibility,"J. Landay, S. Klemmer","In this paper, we address the challenge of virtual reality and collaborative tools. We propose a new system called SmartDB that leverages virtual reality to improve efficiency and performance. Our framework optimizes collaborative tools in a novel way. Experimental results on real-world datasets show that our method outperforms standard baselines, achieving up to 31% improvement in speed and accuracy.",2018,HCI,CSCW,346
86,Optimizing Queries in Graph Database Databases for Raft Consensus,"J. Dean, M. Zaharia, A. Halevy","Recent advancements in graph database have enabled significant breakthroughs in graph database and Raft consensus. However, existing solutions suffer from high overhead and poor scalability when applied to Raft consensus. To overcome these limitations, we introduce NeuroTrust, a lightweight approach. We demonstrate its effectiveness across multiple domains, illustrating its suitability for production environments.",2025,Data Engineering,VLDB,265
36,Evaluating LoRaWAN Coverage and Reliability in Urban Environments,"T. Anderson, M. Ammar","Low-Power Wide-Area Networks (LPWAN) are essential for long-range, battery-powered sensors. We conduct a field study evaluating LoRaWAN packet delivery ratios, signal-to-noise ratios, and battery lifetimes under varying urban dense path loss conditions.",2024,Networks & IoT,IEEE IoT-J,49
107,Co-designing User Experience with Users for Accessibility Applications,"B. Shneiderman, S. Klemmer, P. Baudisch","We investigate the integration of user experience and accessibility to solve user experience and accessibility. While promising, this combination introduces security and reliability challenges. We present a formal model and a practical implementation, VeloSense, that addresses these issues through centralized coordination. Our prototypes show that our safety constraints are met with minimal impact on latency.",2022,HCI,CSCW,72
111,Evaluating Haptic Wearables for Gesture Ui Control,"D. Norman, A. Dey, P. Baudisch","How can we scale wearables and gesture UI to meet the demands of modern workloads? We argue that standard methods focusing on wearables are insufficient due to physical constraints. We propose NeuroFlow, which distributes computation using gesture UI. Through mathematical proof and extensive simulation, we show that our architecture guarantees fault-tolerance and scales linearly.",2022,HCI,DIS,164
24,Real-time Stream Processing with Kafka and Distributed Ledger Technologies,"M. Zaharia, D. DeWitt","Modern data platforms require real-time processing of high-throughput event streams. We analyze the scalability of Apache Kafka and stream processing frameworks under various partitioning and replication policies, proposing a new dynamic load-balancing algorithm.",2021,Data Engineering,SIGMOD,307
139,An Adaptive Lorawan Slicing Model for Cellular Sensor Networks,"M. Ammar, D. Clark, D. Estrin","How can we scale loRaWAN and sensor networks to meet the demands of modern workloads? We argue that standard methods focusing on loRaWAN are insufficient due to physical constraints. We propose ApexScale, which distributes computation using sensor networks. Through mathematical proof and extensive simulation, we show that our architecture guarantees fault-tolerance and scales linearly.",2025,Networks & IoT,INFOCOM,137
127,Optimizing Network Slicing Routing in IoT-based 5G,"H. Balakrishnan, I. Akyildiz, D. Estrin","This work presents a comprehensive study of network slicing and 5G in the context of 5G. We evaluate different architectures and identify key bottlenecks associated with network slicing. Based on these findings, we design an adaptive protocol, SmartTrust, which dynamically tunes parameters to reduce latency. Our evaluation shows robust performance under highly dynamic workloads.",2023,Networks & IoT,INFOCOM,141
99,Scaling Nosql for Large-scale Partitioning,"A. Halevy, D. DeWitt, H. Garcia-Molina","Recent advancements in NoSQL have enabled significant breakthroughs in NoSQL and partitioning. However, existing solutions suffer from high overhead and poor scalability when applied to partitioning. To overcome these limitations, we introduce SecureGlove, a lightweight approach. We demonstrate its effectiveness across multiple domains, illustrating its suitability for production environments.",2024,Data Engineering,SIGMOD,337
65,Detecting Blockchain Anomalies in Smart Contracts,"S. Goldwasser, R. Anderson","How can we scale blockchain and smart contracts to meet the demands of modern workloads? We argue that standard methods focusing on blockchain are insufficient due to physical constraints. We propose VeloGlove, which distributes computation using smart contracts. Through mathematical proof and extensive simulation, we show that our architecture guarantees fault-tolerance and scales linearly.",2020,Cybersecurity,S&P (Oakland),134
95,Partitioning Architectures: A Survey of Stream Processing Systems,"M. Zaharia, D. DeWitt","This work presents a comprehensive study of partitioning and stream processing in the context of stream processing. We evaluate different architectures and identify key bottlenecks associated with partitioning. Based on these findings, we design an adaptive protocol, SecureGlove, which dynamically tunes parameters to reduce latency. Our evaluation shows robust performance under highly dynamic workloads.",2020,Data Engineering,SIGMOD,215
